{
  "$schema": "./schema.json",
  "version": "0.8.0b1",
  "channel": "stable",
  "releaseDate": "2026-10-27T18:42:25.383879+00:00",
  "platforms": {
    "windows-x64": {
      "url": "https://github.com/kazizillani-oss/CAT_v0.7.9/releases/download/v0.8.0b1/cat-windows-x64.zip",
      "sha256": "e3b0c44298fc1c149afbf4c8996fb92427ae41e4649b934ca495991b7852b855",
      "executable": "cat.exe",
      "archiveType": "zip",
      "sizeBytes": 0,
      "minOsVersion": "10.0"
    },
    "windows-arm64": {
      "url": "https://github.com/kazizillani-oss/CAT_v0.7.9/releases/download/v0.8.0b1/cat-windows-arm64.zip",
      "sha256": "e3b0c44298fc1c149afbf4c8996fb92427ae41e4649b934ca495991b7852b855",
      "executable": "cat.exe",
      "archiveType": "zip",
      "sizeBytes": 0,
      "minOsVersion": "10.0"
    },
    "linux-x64": {
      "url": "https://github.com/kazizillani-oss/CAT_v0.7.9/releases/download/v0.8.0b1/cat-linux-x64.tar.gz",
      "sha256": "e3b0c44298fc1c149afbf4c8996fb92427ae41e4649b934ca495991b7852b855",
      "executable": "cat",
      "archiveType": "tar.gz",
      "sizeBytes": 0,
      "minOsVersion": "glibc-2.31"
    },
    "linux-arm64": {
      "url": "https://github.com/kazizillani-oss/CAT_v0.7.9/releases/download/v0.8.0b1/cat-linux-arm64.tar.gz",
      "sha256": "e3b0c44298fc1c149afbf4c8996fb92427ae41e4649b934ca495991b7852b855",
      "executable": "cat",
      "archiveType": "tar.gz",
      "sizeBytes": 0,
      "minOsVersion": "glibc-2.31"
    },
    "macos-x64": {
      "url": "https://github.com/kazizillani-oss/CAT_v0.7.9/releases/download/v0.8.0b1/cat-macos-x64.tar.gz",
      "sha256": "e3b0c44298fc1c149afbf4c8996fb92427ae41e4649b934ca495991b7852b855",
      "executable": "cat",
      "archiveType": "tar.gz",
      "sizeBytes": 0,
      "minOsVersion": "11.0"
    },
    "macos-arm64": {
      "url": "https://github.com/kazizillani-oss/CAT_v0.7.9/releases/download/v0.8.0b1/cat-macos-arm64.tar.gz",
      "sha256": "e3b0c44298fc1c149afbf4c8996fb92427ae41e4649b934ca495991b7852b855",
      "executable": "cat",
      "archiveType": "tar.gz",
      "sizeBytes": 0,
      "minOsVersion": "11.0"
    }
  },
  "installer": {
    "windows": {
      "url": "https://github.com/kazizillani-oss/CAT_v0.7.9/releases/download/v0.8.0b1/CAT-Setup.exe",
      "sha256": "c534102f8b7266022c69acca46b3c56fcc8c2fba0741e131524d85c154c175b1",
      "sizeBytes": 131072
    }
  },
  "notes": "CAT v0.8.0b1 production release"
}
